{
  "schema_version": "1.0",
  "message_type": "audit_event",
  "created_at": "2026-07-18T10:07:00Z",
  "safety_flags": {
    "synthetic_local_only": true,
    "mock_only": true,
    "dry_run": true,
    "owner_review_required": true,
    "external_side_effects_allowed": false,
    "external_side_effects_occurred": false,
    "blackboard_write_allowed": false,
    "queue_write_allowed": false,
    "audit_trail_write_allowed": false,
    "worker_dispatch_allowed": false,
    "openclaw_call_allowed": false,
    "hermes_runtime_allowed": false,
    "connector_call_allowed": false,
    "google_sheets_write_allowed": false,
    "follow_up_allowed": false,
    "follow_up_requires_owner_confirmation": true
  },
  "prev_entry_hash": "1111111111111111111111111111111111111111111111111111111111111111",
  "execution_class": "AUTO",
  "produced_by": "synthetic-local-fixture",
  "parent_task_id": null,
  "role": "audit_recorder_preview",
  "audit_id": "audit-phase3-001",
  "event_id": "audit-event-phase3-001",
  "task_id": "task-phase3-001",
  "related_result_id": "result-phase3-001",
  "event_type": "dry_run_result_generated",
  "event_notes": "A synthetic result shape was generated; no task was executed.",
  "audit_status": "preview_audit_not_persisted",
  "persistence_target": "none",
  "preview_only": true
}
